
{
  "title": "ProcessingCompletedEvent",
  "$schema": "https://json-schema.org/draft/2020-12/schema",
  "type": "object",
  "additionalProperties": false,
  "properties": {
    "schema_version": {
      "type": "string",
      "pattern": "^\\d+\\.\\d+\\.\\d+$"
    },
    "event_id": {
      "type": "string",
      "format": "uuid"
    },
    "idempotency_key": {
      "type": "string",
      "minLength": 8,
      "maxLength": 256
    },
    "correlation_id": {
      "type": "string",
      "format": "uuid"
    },
    "occurred_at": {
      "type": "string",
      "pattern": "^\\d{4}-\\d{2}-\\d{2}T\\d{2}:\\d{2}:\\d{2}(?:\\.\\d{1,6})?Z$"
    },
    "job_id": {
      "type": [
        "string",
        "null"
      ],
      "format": "uuid"
    },
    "watcher_id": {
      "type": [
        "string",
        "null"
      ],
      "format": "uuid"
    },
    "attempt_number": {
      "type": [
        "integer",
        "null"
      ],
      "minimum": 0
    },
    "event_type": {
      "const": "processing.completed"
    },
    "producer": {
      "const": "processor"
    },
    "payload": {
      "$schema": "https://json-schema.org/draft/2020-12/schema",
      "type": "object",
      "additionalProperties": false,
      "properties": {
        "engine": {
          "enum": [
            "spark",
            "flink"
          ]
        },
        "output_manifest_id": {
          "type": "string",
          "format": "uuid"
        },
        "output_locator": {
          "type": "string",
          "minLength": 1,
          "maxLength": 1024,
          "pattern": "^(?!file://)(?![A-Za-z]:)(?!.*\\\\)(?!.*(?:^|/)\\.\\.(?:/|$)).+$"
        },
        "input_rows": {
          "type": [
            "integer",
            "null"
          ],
          "minimum": 0
        },
        "output_rows": {
          "type": [
            "integer",
            "null"
          ],
          "minimum": 0
        },
        "duration_seconds": {
          "type": "number",
          "minimum": 0
        }
      },
      "required": [
        "engine",
        "output_manifest_id",
        "output_locator",
        "input_rows",
        "output_rows",
        "duration_seconds"
      ]
    }
  },
  "required": [
    "schema_version",
    "event_id",
    "idempotency_key",
    "correlation_id",
    "occurred_at",
    "job_id",
    "watcher_id",
    "attempt_number",
    "event_type",
    "producer",
    "payload"
  ]
}
