{
  "schema_version": "1.0.0",
  "event_type": "processing.completed",
  "event_id": "11111111-1111-4111-8111-111111111111",
  "idempotency_key": "processing.completed:44444444-4444-4444-8444-444444444444:1",
  "correlation_id": "22222222-2222-4222-8222-222222222222",
  "occurred_at": "2026-04-25T23:55:00Z",
  "producer": "processor",
  "job_id": "44444444-4444-4444-8444-444444444444",
  "watcher_id": "33333333-3333-4333-8333-333333333333",
  "attempt_number": 1,
  "payload": {
    "engine": "spark",
    "output_manifest_id": "33333333-3333-4333-8333-333333333333",
    "output_locator": "demo",
    "input_rows": 1,
    "output_rows": 1,
    "duration_seconds": 0.25
  }
}
